{
  "part_type": "mounting_bracket",
  "manufacturing_process": "machining",
  "material": "AL6061",
  "required_views": [
    "top",
    "iso"
  ],
  "drawing_standard": "project-default",
  "missing_semantics_policy": "advisory",
  "datum_strategy": {
    "primary": "plate_top_face",
    "secondary": "left_mounting_hole",
    "tertiary": "right_mounting_hole",
    "scheme": "simple fixture-oriented datum reference",
    "notes": [
      "Use hole centers and plate face as drawing QA references only."
    ]
  },
  "tolerance_policy": {
    "general": "Use existing drawing metadata only; do not infer additional tolerances.",
    "gdt": "none",
    "notes": [
      "No automatic GD&T inference is required for this fixture."
    ]
  },
  "critical_features": [
    {
      "id": "PLATE",
      "feature": "plate",
      "description": "Base plate envelope communicates overall bracket footprint.",
      "reason": "Defines the stock and primary visual context.",
      "view": "top"
    },
    {
      "id": "MOUNTING_HOLES",
      "feature": "hole_left,hole_right",
      "description": "Two mounting hole diameters must remain visible and traceable.",
      "reason": "Hole sizes are required for the strict-pass drawing fixture.",
      "view": "top"
    }
  ],
  "required_dimensions": [
    {
      "id": "HOLE_LEFT_DIA",
      "feature": "hole_left",
      "label": "Left mounting hole diameter",
      "dimension_type": "diameter",
      "value_mm": 6,
      "required": true,
      "view": "top",
      "reason": "Confirms the smaller mounting hole size."
    },
    {
      "id": "HOLE_RIGHT_DIA",
      "feature": "hole_right",
      "label": "Right mounting hole diameter",
      "dimension_type": "diameter",
      "value_mm": 10,
      "required": true,
      "view": "top",
      "reason": "Confirms the larger mounting hole size."
    }
  ],
  "required_notes": [
    {
      "id": "MATERIAL",
      "text": "Material: AL6061",
      "category": "material",
      "required": true
    }
  ]
}
